<?xml version="1.0" encoding="UTF-8"?>
<xs:schema xmlns:xs="http://www.w3.org/2001/XMLSchema" elementFormDefault="qualified">
  <xs:element name="equipos">
    <xs:complexType>
      <xs:sequence>
        <xs:element ref="equipo" maxOccurs="unbounded"/>
      </xs:sequence>
      <xs:attribute name="temp" type="xs:string" use="required"/>
    </xs:complexType>
  </xs:element>
  <xs:element name="equipo">
    <xs:complexType>
      <xs:sequence>
        <xs:element name="nombre" type="xs:string"/>
        <xs:element name="escudo" type="xs:string"/>
      </xs:sequence>
      <xs:attribute name="id" type="xs:string" use="required"/>
    </xs:complexType>
  </xs:element>
</xs:schema>
